{
  "schemaVersion": "1.0",
  "status": "PLAN_ONLY / ALL_CONNECTIONS_DISABLED",
  "generatedAt": "2026-07-20T07:00:00.000Z",
  "authority": {
    "transitionAuthority": "target-managed-postgres-plus-sirinx-control-not-yet-wired",
    "approvalAuthority": "attested-human-operator-only",
    "runtimeProof": "authenticated-endpoint-plus-fresh-heartbeat-plus-task-bound-receipt",
    "secretPolicy": "opaque-host-secret-reference-only"
  },
  "connections": [
    {
      "connectionId": "cloudflare-docs-mcp",
      "service": "Cloudflare documentation MCP",
      "role": "REMOTE_MCP_SERVER",
      "transport": "streamable-http",
      "endpoint": "https://docs.mcp.cloudflare.com/mcp",
      "enabled": false,
      "connectionState": "candidate-not-configured",
      "runtimeEvidence": "UNVERIFIED",
      "authMode": "public-read-only",
      "toolPolicy": "deny-all",
      "dataClassCeiling": "PUBLIC",
      "capabilities": ["cloudflare-documentation-search"],
      "effectKinds": ["CONNECTOR_ACTIVATION"],
      "requiredTicketKinds": ["CONNECTOR_ACTIVATION"],
      "blockers": ["client configuration not approved", "external network canary not approved"],
      "officialSources": ["https://developers.cloudflare.com/workers/get-started/prompting/"],
      "notes": "Public read-only candidate; connecting a client still changes local or cloud connector state."
    },
    {
      "connectionId": "cloudflare-observability-mcp",
      "service": "Cloudflare observability MCP",
      "role": "REMOTE_MCP_SERVER",
      "transport": "streamable-http",
      "endpoint": "https://observability.mcp.cloudflare.com/mcp",
      "enabled": false,
      "connectionState": "candidate-not-configured",
      "runtimeEvidence": "UNVERIFIED",
      "authMode": "oauth-human-required",
      "toolPolicy": "deny-all",
      "dataClassCeiling": "INTERNAL",
      "capabilities": ["cloudflare-observability-read"],
      "effectKinds": ["CONNECTOR_ACTIVATION"],
      "requiredTicketKinds": ["CONNECTOR_ACTIVATION"],
      "blockers": ["OAuth consent not approved", "account scope and retention policy not reviewed"],
      "officialSources": ["https://developers.cloudflare.com/workers/get-started/prompting/"],
      "notes": "No OAuth, account read, or tool call was attempted."
    },
    {
      "connectionId": "sirinx-cloudflare-mcp-portal",
      "service": "SIRINX Cloudflare MCP portal",
      "role": "MCP_PORTAL",
      "transport": "streamable-http",
      "endpoint": null,
      "enabled": false,
      "connectionState": "portal-not-created",
      "runtimeEvidence": "UNVERIFIED",
      "authMode": "cloudflare-access-plus-server-oauth",
      "toolPolicy": "deny-all",
      "dataClassCeiling": "INTERNAL",
      "capabilities": ["central-tool-catalog", "identity-policy", "audit-projection"],
      "effectKinds": ["CONNECTOR_ACTIVATION", "CLOUDFLARE_MUTATION", "DEPLOY"],
      "requiredTicketKinds": ["CONNECTOR_ACTIVATION", "CLOUDFLARE_MUTATION", "DEPLOY"],
      "blockers": ["portal and Worker do not exist", "server-side OAuth and direct-origin protection not designed", "Cloudflare mutation and deploy gates held"],
      "officialSources": ["https://developers.cloudflare.com/cloudflare-one/access-controls/ai-controls/mcp-portals/", "https://developers.cloudflare.com/agents/model-context-protocol/guides/remote-mcp-server/", "https://developers.cloudflare.com/agents/model-context-protocol/protocol/authorization/"],
      "notes": "Future portal must deny every tool by default and must not rely on portal policy alone to protect a directly reachable MCP origin."
    },
    {
      "connectionId": "codex-mcp-client",
      "service": "Codex 0.144.6 local client",
      "role": "MCP_CLIENT",
      "transport": "streamable-http",
      "endpoint": null,
      "enabled": false,
      "connectionState": "client-capability-observed-not-configured",
      "runtimeEvidence": "UNVERIFIED",
      "authMode": "oauth-human-required",
      "toolPolicy": "deny-all",
      "dataClassCeiling": "PUBLIC",
      "capabilities": ["remote-http-mcp-client", "oauth-client-metadata"],
      "effectKinds": ["CONNECTOR_ACTIVATION"],
      "requiredTicketKinds": ["CONNECTOR_ACTIVATION"],
      "blockers": ["no Codex MCP configuration inspected or changed", "target server and tool allowlist not approved"],
      "officialSources": [],
      "notes": "Capability was observed from local command help only; this registry does not assert a configured connection."
    },
    {
      "connectionId": "claude-code-mcp-client",
      "service": "Claude Code 2.1.212 local client",
      "role": "MCP_CLIENT",
      "transport": "streamable-http",
      "endpoint": null,
      "enabled": false,
      "connectionState": "client-capability-observed-not-configured",
      "runtimeEvidence": "UNVERIFIED",
      "authMode": "oauth-human-required",
      "toolPolicy": "deny-all",
      "dataClassCeiling": "PUBLIC",
      "capabilities": ["remote-http-mcp-client", "oauth-login"],
      "effectKinds": ["CONNECTOR_ACTIVATION"],
      "requiredTicketKinds": ["CONNECTOR_ACTIVATION"],
      "blockers": ["no Claude MCP configuration inspected or changed", "target server and tool allowlist not approved"],
      "officialSources": ["https://support.claude.com/en/articles/11175166-get-started-with-custom-connectors-using-remote-mcp"],
      "notes": "Local help confirms an MCP client surface; that is not a live connector receipt."
    },
    {
      "connectionId": "claude-cowork-remote-connector",
      "service": "Claude Cowork custom connector",
      "role": "MCP_CLIENT",
      "transport": "cloud-connector",
      "endpoint": null,
      "enabled": false,
      "connectionState": "candidate-not-configured",
      "runtimeEvidence": "UNVERIFIED",
      "authMode": "oauth-human-required",
      "toolPolicy": "deny-all",
      "dataClassCeiling": "PUBLIC",
      "capabilities": ["anthropic-cloud-originated-remote-mcp"],
      "effectKinds": ["CONNECTOR_ACTIVATION"],
      "requiredTicketKinds": ["CONNECTOR_ACTIVATION"],
      "blockers": ["authenticated connector setup not approved", "remote server must be reachable from Anthropic cloud", "OAuth scopes and data policy not reviewed"],
      "officialSources": ["https://support.claude.com/en/articles/11175166-get-started-with-custom-connectors-using-remote-mcp"],
      "notes": "Desktop UI presence or a shared session does not prove that a Cowork connector exists."
    },
    {
      "connectionId": "kimi-code-mcp-client",
      "service": "Kimi Code 0.27.0 local client",
      "role": "MCP_CLIENT",
      "transport": "none",
      "endpoint": null,
      "enabled": false,
      "connectionState": "installed-version-mcp-unverified",
      "runtimeEvidence": "UNVERIFIED",
      "authMode": "not-applicable",
      "toolPolicy": "deny-all",
      "dataClassCeiling": "PUBLIC",
      "capabilities": ["acp-observed", "top-level-mcp-subcommand-not-observed"],
      "effectKinds": ["CONNECTOR_ACTIVATION"],
      "requiredTicketKinds": ["CONNECTOR_ACTIVATION"],
      "blockers": ["top-level help exposed no MCP command", "interactive MCP capability of exact installed revision 0.27.0 was not verified", "ACP is not MCP or A2A"],
      "officialSources": ["https://github.com/MoonshotAI/kimi-code"],
      "notes": "Current Kimi Code upstream documents conversational /mcp-config, but exact installed-revision support is unverified; no upgrade or configuration was attempted."
    },
    {
      "connectionId": "hermes-mcp-client",
      "service": "Hermes Agent 0.18.2 local client",
      "role": "MCP_CLIENT",
      "transport": "streamable-http",
      "endpoint": null,
      "enabled": false,
      "connectionState": "protected-config-unread-not-configured",
      "runtimeEvidence": "UNVERIFIED",
      "authMode": "protected-config-unread",
      "toolPolicy": "deny-all",
      "dataClassCeiling": "PUBLIC",
      "capabilities": ["remote-http-mcp-client", "stdio-mcp-client", "oauth-capable-upstream"],
      "effectKinds": ["CONNECTOR_ACTIVATION"],
      "requiredTicketKinds": ["CONNECTOR_ACTIVATION"],
      "blockers": ["protected Hermes configuration was not read or changed", "local revision trails current upstream", "target server and tool filters not approved"],
      "officialSources": ["https://github.com/NousResearch/hermes-agent/blob/main/website/docs/user-guide/features/mcp.md"],
      "notes": "Official feature support is not evidence that this local Hermes instance has any configured MCP server."
    },
    {
      "connectionId": "hermes-messaging-mcp-server",
      "service": "Hermes messaging MCP serve mode",
      "role": "LOCAL_MCP_SERVER",
      "transport": "stdio",
      "endpoint": null,
      "enabled": false,
      "connectionState": "candidate-not-configured",
      "runtimeEvidence": "UNVERIFIED",
      "authMode": "host-secret-reference-required",
      "toolPolicy": "deny-all",
      "dataClassCeiling": "INTERNAL",
      "capabilities": ["messaging-tool-surface", "local-stdio-server"],
      "effectKinds": ["CONNECTOR_ACTIVATION", "LIVE_SEND"],
      "requiredTicketKinds": ["CONNECTOR_ACTIVATION", "LIVE_SEND"],
      "blockers": ["server not started", "send-capable tools require a filtered proxy and separate live-send grants", "protected credentials remain unread"],
      "officialSources": ["https://github.com/NousResearch/hermes-agent/blob/main/website/docs/user-guide/features/mcp.md"],
      "notes": "Do not expose a broad messaging server to the mesh; split read-only metadata from exact-destination sends."
    },
    {
      "connectionId": "line-official-local-mcp",
      "service": "LINE Official preview MCP 0.5.0",
      "role": "LOCAL_MCP_SERVER",
      "transport": "stdio",
      "endpoint": null,
      "enabled": false,
      "connectionState": "disabled-existing-config",
      "runtimeEvidence": "UNVERIFIED",
      "authMode": "host-secret-reference-required",
      "toolPolicy": "deny-all",